{
  "meta": {
    "title": "Controlador PID com AmpOp",
    "description": "PID paralelo com 3 estagios (P, I, D) e somador inversor, usando 4x LM741. Entrada ERROR, saida VOUT, alimentacao simetrica via V+ e V-. Valores de R e C sao placeholders a dimensionar.",
    "top_name": "pid_controller_lm741"
  },
  "nets": [
    {
      "name": "GND",
      "type": "power"
    },
    {
      "name": "V+",
      "type": "power"
    },
    {
      "name": "V-",
      "type": "power"
    },
    {
      "name": "ERROR",
      "type": "input"
    },
    {
      "name": "U1_INV",
      "type": "passive"
    },
    {
      "name": "U2_INV",
      "type": "passive"
    },
    {
      "name": "U3_INV",
      "type": "passive"
    },
    {
      "name": "P_OUT",
      "type": "passive"
    },
    {
      "name": "I_OUT",
      "type": "passive"
    },
    {
      "name": "D_OUT",
      "type": "passive"
    },
    {
      "name": "SUM_NODE",
      "type": "passive"
    },
    {
      "name": "VOUT",
      "type": "output"
    }
  ],
  "parts": [
    {
      "lib": "Device",
      "name": "R",
      "ref": "R1",
      "value": "R"
    },
    {
      "lib": "Device",
      "name": "R",
      "ref": "R2",
      "value": "R"
    },
    {
      "lib": "Device",
      "name": "R",
      "ref": "R3",
      "value": "R"
    },
    {
      "lib": "Device",
      "name": "C",
      "ref": "C1",
      "value": "C"
    },
    {
      "lib": "Device",
      "name": "C",
      "ref": "C2",
      "value": "C"
    },
    {
      "lib": "Device",
      "name": "R",
      "ref": "R4",
      "value": "R"
    },
    {
      "lib": "Device",
      "name": "R",
      "ref": "R5",
      "value": "R"
    },
    {
      "lib": "Device",
      "name": "R",
      "ref": "R6",
      "value": "R"
    },
    {
      "lib": "Device",
      "name": "R",
      "ref": "R7",
      "value": "R"
    },
    {
      "lib": "Device",
      "name": "R",
      "ref": "R8",
      "value": "R"
    },
    {
      "lib": "Amplifier_Operational",
      "name": "LM741",
      "ref": "U1",
      "value": "LM741",
      "no_connect": [
        1,
        5,
        8
      ]
    },
    {
      "lib": "Amplifier_Operational",
      "name": "LM741",
      "ref": "U2",
      "value": "LM741",
      "no_connect": [
        1,
        5,
        8
      ]
    },
    {
      "lib": "Amplifier_Operational",
      "name": "LM741",
      "ref": "U3",
      "value": "LM741",
      "no_connect": [
        1,
        5,
        8
      ]
    },
    {
      "lib": "Amplifier_Operational",
      "name": "LM741",
      "ref": "U4",
      "value": "LM741",
      "no_connect": [
        1,
        5,
        8
      ]
    }
  ],
  "connections": [
    {
      "net": "GND",
      "pins": [
        "U1.3",
        "U2.3",
        "U3.3",
        "U4.3"
      ]
    },
    {
      "net": "V+",
      "pins": [
        "U1.7",
        "U2.7",
        "U3.7",
        "U4.7"
      ]
    },
    {
      "net": "V-",
      "pins": [
        "U1.4",
        "U2.4",
        "U3.4",
        "U4.4"
      ]
    },
    {
      "net": "ERROR",
      "pins": [
        "R1.1",
        "R3.1",
        "C2.1"
      ]
    },
    {
      "net": "U1_INV",
      "pins": [
        "U1.2",
        "R1.2",
        "R2.2"
      ]
    },
    {
      "net": "U2_INV",
      "pins": [
        "U2.2",
        "R3.2",
        "C1.2"
      ]
    },
    {
      "net": "U3_INV",
      "pins": [
        "U3.2",
        "C2.2",
        "R4.2"
      ]
    },
    {
      "net": "P_OUT",
      "pins": [
        "U1.6",
        "R2.1",
        "R5.1"
      ]
    },
    {
      "net": "I_OUT",
      "pins": [
        "U2.6",
        "C1.1",
        "R6.1"
      ]
    },
    {
      "net": "D_OUT",
      "pins": [
        "U3.6",
        "R4.1",
        "R7.1"
      ]
    },
    {
      "net": "SUM_NODE",
      "pins": [
        "U4.2",
        "R5.2",
        "R6.2",
        "R7.2",
        "R8.2"
      ]
    },
    {
      "net": "VOUT",
      "pins": [
        "U4.6",
        "R8.1"
      ]
    }
  ]
}
